{
  "agent": "devin",
  "os": "windows",
  "arch": "amd64",
  "go_version": "go1.26.6 windows/amd64",
  "node_version": "v24.16.0",
  "pnpm_version": "10.33.0",
  "date": "2026-09-05T23:55:39+08:00",
  "commit": "164de417",
  "duration_seconds": 1500,
  "commands": [
    {
      "name": "build-full",
      "command": "go build -tags goolm,stdjson ./...",
      "exit_code": 0,
      "duration_seconds": 90,
      "output_excerpt": "clean build, CGO_ENABLED=0"
    },
    {
      "name": "test-full",
      "command": "go test -tags goolm,stdjson ./...",
      "exit_code": 0,
      "duration_seconds": 360,
      "output_excerpt": "97 packages ok, 24 no-test-files, 0 failures",
      "log_file": "D:\\tmp\\rhizome-test-full.log"
    },
    {
      "name": "test-mesh-focused",
      "command": "go test -tags goolm,stdjson -count=1 ./pkg/rhizome/network/ ./pkg/rhizome/mesh/ ./pkg/rhizome/sync/ ./pkg/rhizome/stream/ ./pkg/rhizome/agentrpc/ ./pkg/rhizome/agenttask/",
      "exit_code": 0,
      "duration_seconds": 60,
      "output_excerpt": "network 11.7s, mesh 13.7s, sync 29.5s, stream 2.5s ok; agentrpc/agenttask no test files"
    },
    {
      "name": "integration-mesh",
      "command": "powershell -File scripts\\integration-mesh.ps1",
      "exit_code": 0,
      "duration_seconds": 90,
      "output_excerpt": "Integration test passed: ping, bidirectional workspace sync, and reconnect catch-up all work.",
      "log_file": "D:\\tmp\\rhizome-integration-mesh-2.log"
    },
    {
      "name": "web-install",
      "command": "npx pnpm install --frozen-lockfile",
      "exit_code": 0,
      "duration_seconds": 2
    },
    {
      "name": "web-build-backend",
      "command": "npx pnpm build:backend",
      "exit_code": 0,
      "duration_seconds": 3,
      "output_excerpt": "built into web/backend/dist in 2.47s"
    },
    {
      "name": "web-lint",
      "command": "npx pnpm lint",
      "exit_code": 0,
      "duration_seconds": 10,
      "output_excerpt": "0 errors, 1 pre-existing warning (channel-config-page.tsx exhaustive-deps)"
    },
    {
      "name": "web-format",
      "command": "npx pnpm format",
      "exit_code": 1,
      "duration_seconds": 10,
      "output_excerpt": "prettier --check: 18 files flagged, all pre-existing and unrelated to this change set"
    },
    {
      "name": "gofmt-vet-changed",
      "command": "gofmt -l <changed files>; go vet -tags goolm,stdjson ./cmd/rhizome ./pkg/config ./pkg/rhizome/mesh ./pkg/events",
      "exit_code": 0,
      "duration_seconds": 30,
      "output_excerpt": "clean"
    }
  ],
  "results": {
    "passed_packages": [
      "github.com/stpinkie/rhizome/cmd/membench",
      "github.com/stpinkie/rhizome/cmd/rhizome",
      "github.com/stpinkie/rhizome/cmd/rhizome/internal",
      "github.com/stpinkie/rhizome/cmd/rhizome/internal/agent",
      "github.com/stpinkie/rhizome/cmd/rhizome/internal/auth",
      "github.com/stpinkie/rhizome/cmd/rhizome/internal/cliui",
      "github.com/stpinkie/rhizome/cmd/rhizome/internal/cron",
      "github.com/stpinkie/rhizome/cmd/rhizome/internal/gateway",
      "github.com/stpinkie/rhizome/cmd/rhizome/internal/mcp",
      "github.com/stpinkie/rhizome/cmd/rhizome/internal/migrate",
      "github.com/stpinkie/rhizome/cmd/rhizome/internal/model",
      "github.com/stpinkie/rhizome/cmd/rhizome/internal/network",
      "github.com/stpinkie/rhizome/cmd/rhizome/internal/onboard",
      "github.com/stpinkie/rhizome/cmd/rhizome/internal/skills",
      "github.com/stpinkie/rhizome/cmd/rhizome/internal/status",
      "github.com/stpinkie/rhizome/cmd/rhizome/internal/sync",
      "github.com/stpinkie/rhizome/cmd/rhizome/internal/version",
      "github.com/stpinkie/rhizome/integration",
      "github.com/stpinkie/rhizome/pkg/agent",
      "github.com/stpinkie/rhizome/pkg/audio",
      "github.com/stpinkie/rhizome/pkg/audio/asr",
      "github.com/stpinkie/rhizome/pkg/audio/tts",
      "github.com/stpinkie/rhizome/pkg/auth",
      "github.com/stpinkie/rhizome/pkg/bus",
      "github.com/stpinkie/rhizome/pkg/channels",
      "github.com/stpinkie/rhizome/pkg/channels/deltachat",
      "github.com/stpinkie/rhizome/pkg/channels/dingtalk",
      "github.com/stpinkie/rhizome/pkg/channels/discord",
      "github.com/stpinkie/rhizome/pkg/channels/feishu",
      "github.com/stpinkie/rhizome/pkg/channels/irc",
      "github.com/stpinkie/rhizome/pkg/channels/line",
      "github.com/stpinkie/rhizome/pkg/channels/matrix",
      "github.com/stpinkie/rhizome/pkg/channels/onebot",
      "github.com/stpinkie/rhizome/pkg/channels/pico",
      "github.com/stpinkie/rhizome/pkg/channels/qq",
      "github.com/stpinkie/rhizome/pkg/channels/slack",
      "github.com/stpinkie/rhizome/pkg/channels/slack_webhook",
      "github.com/stpinkie/rhizome/pkg/channels/teams_webhook",
      "github.com/stpinkie/rhizome/pkg/channels/telegram",
      "github.com/stpinkie/rhizome/pkg/channels/vk",
      "github.com/stpinkie/rhizome/pkg/channels/wecom",
      "github.com/stpinkie/rhizome/pkg/channels/weixin",
      "github.com/stpinkie/rhizome/pkg/channels/whatsapp",
      "github.com/stpinkie/rhizome/pkg/commands",
      "github.com/stpinkie/rhizome/pkg/config",
      "github.com/stpinkie/rhizome/pkg/credential",
      "github.com/stpinkie/rhizome/pkg/cron",
      "github.com/stpinkie/rhizome/pkg/events",
      "github.com/stpinkie/rhizome/pkg/evolution",
      "github.com/stpinkie/rhizome/pkg/fileutil",
      "github.com/stpinkie/rhizome/pkg/gateway",
      "github.com/stpinkie/rhizome/pkg/health",
      "github.com/stpinkie/rhizome/pkg/heartbeat",
      "github.com/stpinkie/rhizome/pkg/identity",
      "github.com/stpinkie/rhizome/pkg/isolation",
      "github.com/stpinkie/rhizome/pkg/logger",
      "github.com/stpinkie/rhizome/pkg/mcp",
      "github.com/stpinkie/rhizome/pkg/media",
      "github.com/stpinkie/rhizome/pkg/memory",
      "github.com/stpinkie/rhizome/pkg/migrate",
      "github.com/stpinkie/rhizome/pkg/migrate/internal",
      "github.com/stpinkie/rhizome/pkg/migrate/sources/openclaw",
      "github.com/stpinkie/rhizome/pkg/netbind",
      "github.com/stpinkie/rhizome/pkg/pid",
      "github.com/stpinkie/rhizome/pkg/providers",
      "github.com/stpinkie/rhizome/pkg/providers/anthropic_messages",
      "github.com/stpinkie/rhizome/pkg/providers/azure",
      "github.com/stpinkie/rhizome/pkg/providers/bedrock",
      "github.com/stpinkie/rhizome/pkg/providers/cli",
      "github.com/stpinkie/rhizome/pkg/providers/common",
      "github.com/stpinkie/rhizome/pkg/providers/gemini",
      "github.com/stpinkie/rhizome/pkg/providers/oauth",
      "github.com/stpinkie/rhizome/pkg/providers/openai_compat",
      "github.com/stpinkie/rhizome/pkg/providers/openai_responses_common",
      "github.com/stpinkie/rhizome/pkg/rhizome/identity",
      "github.com/stpinkie/rhizome/pkg/rhizome/merge",
      "github.com/stpinkie/rhizome/pkg/rhizome/mesh",
      "github.com/stpinkie/rhizome/pkg/rhizome/network",
      "github.com/stpinkie/rhizome/pkg/rhizome/stream",
      "github.com/stpinkie/rhizome/pkg/rhizome/sync",
      "github.com/stpinkie/rhizome/pkg/routing",
      "github.com/stpinkie/rhizome/pkg/seahorse",
      "github.com/stpinkie/rhizome/pkg/session",
      "github.com/stpinkie/rhizome/pkg/skills",
      "github.com/stpinkie/rhizome/pkg/state",
      "github.com/stpinkie/rhizome/pkg/tools",
      "github.com/stpinkie/rhizome/pkg/tools/fs",
      "github.com/stpinkie/rhizome/pkg/tools/hardware",
      "github.com/stpinkie/rhizome/pkg/tools/integration",
      "github.com/stpinkie/rhizome/pkg/tools/shared",
      "github.com/stpinkie/rhizome/pkg/updater",
      "github.com/stpinkie/rhizome/pkg/utils",
      "github.com/stpinkie/rhizome/web/backend",
      "github.com/stpinkie/rhizome/web/backend/api",
      "github.com/stpinkie/rhizome/web/backend/launcherconfig",
      "github.com/stpinkie/rhizome/web/backend/middleware",
      "github.com/stpinkie/rhizome/web/backend/utils"
    ],
    "failed_packages": [],
    "skipped_packages": [
      "pkg/devices/events (no test files)",
      "pkg/devices/sources (no test files)",
      "pkg/providers/messageutil (no test files)",
      "pkg/providers/protocoltypes (no test files)",
      "pkg/rhizome/agentrpc (no test files)",
      "pkg/rhizome/agenttask (no test files)",
      "pkg/tokenizer (no test files)",
      "scripts (no test files)",
      "web/backend/dashboardauth (no test files)",
      "web/backend/model (no test files)"
    ],
    "known_failures": []
  },
  "summary": "PASS",
  "notes": "Working tree included uncommitted v0.5.0 hardening changes on top of 164de417 (require_signed_caps default true, nonce/timestamp required on agent protocol, RHIZOME banner, stale.yml cron re-enabled, docs refresh). Found+fixed a real bug in scripts/integration-mesh.ps1: Where-Object scalar-unwrap broke process tracking at the daemon-B restart step. Windows Firewall left enabled; mDNS warnings are harmless for this suite. pnpm format flags 18 pre-existing prettier issues on untouched files. internal.Logo remains the lobster emoji (pkg/env.go) — branding decision left to maintainer."
}
